{
  "schema_version": "0.1.0",
  "source_ref": "/home/lyric/growth-engine-pipeline/content/runs/20260322_125025__x_whitelist_ingest__official_x_original_only/03_source_items/official_x/items/x-cohere-b6b7af400c7f/source_item.json",
  "framework_match_ref": "/home/lyric/growth-engine-pipeline/content/runs/20260322_125025__x_whitelist_ingest__official_x_original_only/06_routing/official_x/results/x-cohere-b6b7af400c7f/framework_match.json",
  "rewrite_context_ref": "/home/lyric/growth-engine-pipeline/content/runs/20260322_125025__x_whitelist_ingest__official_x_original_only/07_rewrite_contexts/official_x/results/x-cohere-b6b7af400c7f/rewrite_context.json",
  "model": "gpt-5.4",
  "generated_at": "2026-03-22T12:55:59Z",
  "output_language": "zh-CN",
  "framework_id": "03_opinion_decode",
  "submode_id": "signal_decode",
  "requires_human_review": false,
  "title": "Cohere 在 GTC 没有强调“更强模型”，这反而更值得警惕",
  "dek": "这条来自 San Jose 的会后动态，表面上是在感谢伙伴和回顾行程，真正泄露出来的却是另一件事：企业 AI 的竞争重心，至少在 Cohere 想让外界看到的版本里，已经不再是单纯拼参数和演示效果。",
  "body_markdown": "如果你还把 GTC 上的公司动态理解成一轮热闹的品牌露出，这条来自 Cohere、发布于 2026 年 3 月 20 日的帖文其实在提醒你，旧框架已经有点失效了。它没有拿一个新模型名号当标题，也没有抛出夸张性能数字；它先摆出来的，是 San Jose、NVIDIA GTC、还有几组很企业的关键词：硬件效率、企业级自动化、全栈创新。\n\n这不是修辞上的小差别。对一家做大模型和企业 AI 的公司来说，公开场合究竟优先强调什么，往往比它补充了多少形容词更有信号价值。Cohere 这次想让外界记住的，明显不是“我们也在追最新一轮模型热潮”，而是“我们知道企业真正卡在哪里，也知道要怎么把系统跑起来”。\n\n先把原话降噪一下，这条动态核心只说了几件事：Cohere 团队在 GTC 做了多场分享；内容覆盖硬件效率、企业级自动化、全栈创新；CEO Aidan Gomez 还上了 GTC live stage，谈企业客户的机会、企业技术进入全球经济体的障碍，以及他对 AI 采用演化过程中最意外的部分；另外，他们还点名提到了 Dell、Microsoft、Oracle、CoreWeave 这些客户和伙伴。\n\n单看信息量，其实不大。真正值得解码的，不是“他们去了 GTC”，而是他们把哪几件事并排放在了一起。\n\n## 从“模型能力”转向“部署能力”\n\n注意到了吧？在这条帖文里，最靠前的位置不是模型名字，不是 benchmark，也不是某个单点功能，而是硬件效率。这个顺序很说明问题。因为一旦话题进入硬件效率，讨论就已经不只是“模型聪不聪明”，而是“这个系统值不值得大规模部署”。\n\n这背后对应的是企业 AI 最现实的一层筛选：再强的模型，如果推理成本、延迟、资源占用、运维复杂度压不下来，最后也很难进到稳定生产环境。Cohere 没有展开技术细节，但它公开把“hardware efficiency”摆在前面，本身就在告诉外界，他们希望自己被理解成一家更靠近落地效率的公司，而不只是算法竞赛选手。\n\n再往后看，“enterprise-grade automation”比“automation”多出来的那半步，也不是客套。企业级自动化的意思从来不只是能自动做点事，而是能接进流程、扛得住权限、审计、稳定性和责任边界。很多 AI 演示停在第一层，真正难的是第二层：谁来接入，谁来维护，出了问题谁担责，跨地区和跨组织后还能不能工作。\n\n这里也就连上了 Aidan Gomez 在现场谈的另一个主题：把企业技术部署进全球经济体的障碍。这个表述很宽，但宽得有价值。它至少说明，Cohere 没把企业 AI 的难题仅仅定义成“客户还没被教育好”，而是承认落地本身就有结构性摩擦。问题不止在模型，也在组织、地区、基础设施和合规环境的交界处。\n\n## 这条动态真正重的，不是热闹，是排序\n\n很多公司发会后帖，喜欢把所有亮点堆成一串，让你觉得生态繁荣、朋友很多、现场很热。Cohere 当然也提到了伙伴，Dell、Microsoft、Oracle、CoreWeave 都在名单里。但如果要做优先级排序，最重要的信号不是这串名字，而是这些名字和前面的主题能拼成一条相对完整的叙事：企业 AI 不是一个模型单挑全场的故事，它越来越像一条跨硬件、云、集成、交付的链条。\n\n这也是为什么“innovation across the stack”这个说法需要认真看。它听上去很宽泛，几乎像所有公司都会说的话；可一旦和硬件效率、企业级自动化放在同一句里，它的意思就具体了不少。Cohere 想强调的创新，不像是在单点突破上炫技，更像是在整条栈上找现实可用性的平衡。\n\n简单说，帖文表面是在回顾一周行程，底层其实在重新定义它希望被市场如何理解：不是只卖一个模型结果，而是参与企业 AI 的整套交付问题。\n\n## 为什么这比一条普通参会动态更值得看\n\n因为它纠正了一个常见误读。外界看 AI 公司，太容易把注意力全压在“谁又发了新模型、谁又打破了什么纪录”。但对企业客户来说，真正决定采购和扩张的，往往不是那一刻最亮眼的演示，而是几年后还能不能跑、能不能接进现有系统、能不能跨地区复制。\n\n从这个角度看，Cohere 在 GTC 上选择强调的内容，至少暴露出它对下一阶段竞争的判断：会说故事已经不够了，企业现在更想听的是，你怎么把算力、自动化、系统集成和部署障碍一起处理掉。谁能把这几个问题捆成一个可执行方案，谁就更接近真实收入，而不只是行业声量。\n\n当然，这条帖文本身也有边界。它没有给出具体案例，没有展开任何一场演讲的细节，也没有说明 Aidan Gomez 所说的“surprised him most about the evolution of AI adoption”到底是什么。你不能仅凭这段文字，就把它当成一份完整行业判断书。\n\n但正因为它克制，信号反而清楚。公司在公共场合最先端出来的那组词，通常就是它最想占据的位置。Cohere 这次没有把自己包装成又一个模型舞台明星，而是更像一个在争夺企业执行层入口的玩家。\n\n问题也就回到开头：这到底只是一次会后宣传，还是一轮竞争重心变化的侧写？仅凭这一条动态，还不足以下定论；可如果你在 2026 年还只盯着模型发布节奏，可能已经错过了更关键的那层迁移。真正开始分胜负的地方，未必是在台上谁更会展示智能，而是在台下谁更能把智能安进现实世界。",
  "preserved_fact_anchors": [
    "Cohere",
    "San Jose",
    "NVIDIAGTC",
    "Aidan Gomez",
    "Dell",
    "Microsoft",
    "Oracle",
    "CoreWeave",
    "2026-03-20T16:09:23Z",
    "hardware efficiency"
  ],
  "style_observations": [
    "以单条外部信号为入口，重点做了降噪、排序和重组，而不是复述会后动态。",
    "开头直接打破“普通参会总结”的默认理解，前两段即建立冲突和判断。",
    "中段通过“模型能力 vs 部署能力”“热闹名单 vs 真实排序”两次切换，持续重新争取注意力。",
    "结尾没有回到活动 recap，而是抬高到企业采用决策与竞争重心变化。"
  ],
  "open_questions": [
    "Cohere 团队在 GTC 的具体演讲题目和内容细节，原始来源未提供。",
    "Aidan Gomez 在 live stage 上提到的“AI adoption 演化中最让他意外的部分”具体是什么，来源未展开。",
    "“将企业技术部署进全球经济体的障碍”包含哪些具体障碍，原帖没有列出，因此正文未做细化。"
  ],
  "article_blocks": [
    {
      "type": "hero_heading",
      "text": "这条来自 San Jose 的会后动态，表面上是在感谢伙伴和回顾行程，真正泄露出来的却是另一件事：企业 AI 的竞争重心，至少在 Cohere 想让外界看到的版本里，已经不再是单纯拼参数和演示效果。"
    },
    {
      "type": "paragraph",
      "text": "如果你还把 GTC 上的公司动态理解成一轮热闹的品牌露出，这条来自 Cohere、发布于 2026 年 3 月 20 日的帖文其实在提醒你，旧框架已经有点失效了。它没有拿一个新模型名号当标题，也没有抛出夸张性能数字；它先摆出来的，是 San Jose、NVIDIA GTC、还有几组很企业的关键词：硬件效率、企业级自动化、全栈创新。"
    },
    {
      "type": "paragraph",
      "text": "这不是修辞上的小差别。对一家做大模型和企业 AI 的公司来说，公开场合究竟优先强调什么，往往比它补充了多少形容词更有信号价值。Cohere 这次想让外界记住的，明显不是“我们也在追最新一轮模型热潮”，而是“我们知道企业真正卡在哪里，也知道要怎么把系统跑起来”。"
    },
    {
      "type": "paragraph",
      "text": "先把原话降噪一下，这条动态核心只说了几件事：Cohere 团队在 GTC 做了多场分享；内容覆盖硬件效率、企业级自动化、全栈创新；CEO Aidan Gomez 还上了 GTC live stage，谈企业客户的机会、企业技术进入全球经济体的障碍，以及他对 AI 采用演化过程中最意外的部分；另外，他们还点名提到了 Dell、Microsoft、Oracle、CoreWeave 这些客户和伙伴。"
    },
    {
      "type": "paragraph",
      "text": "单看信息量，其实不大。真正值得解码的，不是“他们去了 GTC”，而是他们把哪几件事并排放在了一起。"
    },
    {
      "type": "section_heading",
      "text": "从“模型能力”转向“部署能力”"
    },
    {
      "type": "paragraph",
      "text": "注意到了吧？在这条帖文里，最靠前的位置不是模型名字，不是 benchmark，也不是某个单点功能，而是硬件效率。这个顺序很说明问题。因为一旦话题进入硬件效率，讨论就已经不只是“模型聪不聪明”，而是“这个系统值不值得大规模部署”。"
    },
    {
      "type": "paragraph",
      "text": "这背后对应的是企业 AI 最现实的一层筛选：再强的模型，如果推理成本、延迟、资源占用、运维复杂度压不下来，最后也很难进到稳定生产环境。Cohere 没有展开技术细节，但它公开把“hardware efficiency”摆在前面，本身就在告诉外界，他们希望自己被理解成一家更靠近落地效率的公司，而不只是算法竞赛选手。"
    },
    {
      "type": "paragraph",
      "text": "再往后看，“enterprise-grade automation”比“automation”多出来的那半步，也不是客套。企业级自动化的意思从来不只是能自动做点事，而是能接进流程、扛得住权限、审计、稳定性和责任边界。很多 AI 演示停在第一层，真正难的是第二层：谁来接入，谁来维护，出了问题谁担责，跨地区和跨组织后还能不能工作。"
    },
    {
      "type": "paragraph",
      "text": "这里也就连上了 Aidan Gomez 在现场谈的另一个主题：把企业技术部署进全球经济体的障碍。这个表述很宽，但宽得有价值。它至少说明，Cohere 没把企业 AI 的难题仅仅定义成“客户还没被教育好”，而是承认落地本身就有结构性摩擦。问题不止在模型，也在组织、地区、基础设施和合规环境的交界处。"
    },
    {
      "type": "section_heading",
      "text": "这条动态真正重的，不是热闹，是排序"
    },
    {
      "type": "paragraph",
      "text": "很多公司发会后帖，喜欢把所有亮点堆成一串，让你觉得生态繁荣、朋友很多、现场很热。Cohere 当然也提到了伙伴，Dell、Microsoft、Oracle、CoreWeave 都在名单里。但如果要做优先级排序，最重要的信号不是这串名字，而是这些名字和前面的主题能拼成一条相对完整的叙事：企业 AI 不是一个模型单挑全场的故事，它越来越像一条跨硬件、云、集成、交付的链条。"
    },
    {
      "type": "paragraph",
      "text": "这也是为什么“innovation across the stack”这个说法需要认真看。它听上去很宽泛，几乎像所有公司都会说的话；可一旦和硬件效率、企业级自动化放在同一句里，它的意思就具体了不少。Cohere 想强调的创新，不像是在单点突破上炫技，更像是在整条栈上找现实可用性的平衡。"
    },
    {
      "type": "paragraph",
      "text": "简单说，帖文表面是在回顾一周行程，底层其实在重新定义它希望被市场如何理解：不是只卖一个模型结果，而是参与企业 AI 的整套交付问题。"
    },
    {
      "type": "section_heading",
      "text": "为什么这比一条普通参会动态更值得看"
    },
    {
      "type": "paragraph",
      "text": "因为它纠正了一个常见误读。外界看 AI 公司，太容易把注意力全压在“谁又发了新模型、谁又打破了什么纪录”。但对企业客户来说，真正决定采购和扩张的，往往不是那一刻最亮眼的演示，而是几年后还能不能跑、能不能接进现有系统、能不能跨地区复制。"
    },
    {
      "type": "paragraph",
      "text": "从这个角度看，Cohere 在 GTC 上选择强调的内容，至少暴露出它对下一阶段竞争的判断：会说故事已经不够了，企业现在更想听的是，你怎么把算力、自动化、系统集成和部署障碍一起处理掉。谁能把这几个问题捆成一个可执行方案，谁就更接近真实收入，而不只是行业声量。"
    },
    {
      "type": "paragraph",
      "text": "当然，这条帖文本身也有边界。它没有给出具体案例，没有展开任何一场演讲的细节，也没有说明 Aidan Gomez 所说的“surprised him most about the evolution of AI adoption”到底是什么。你不能仅凭这段文字，就把它当成一份完整行业判断书。"
    },
    {
      "type": "paragraph",
      "text": "但正因为它克制，信号反而清楚。公司在公共场合最先端出来的那组词，通常就是它最想占据的位置。Cohere 这次没有把自己包装成又一个模型舞台明星，而是更像一个在争夺企业执行层入口的玩家。"
    },
    {
      "type": "paragraph",
      "text": "问题也就回到开头：这到底只是一次会后宣传，还是一轮竞争重心变化的侧写？仅凭这一条动态，还不足以下定论；可如果你在 2026 年还只盯着模型发布节奏，可能已经错过了更关键的那层迁移。真正开始分胜负的地方，未必是在台上谁更会展示智能，而是在台下谁更能把智能安进现实世界。"
    },
    {
      "type": "link_cta",
      "text": "如果你想看原始论证链，可以直接读原文：",
      "url": "https://x.com/cohere/status/2035025921283883153",
      "label": "来源链接 · x.com"
    }
  ],
  "publishing_hints": {
    "source_label": "Cohere",
    "source_url": "https://x.com/cohere/status/2035025921283883153",
    "primary_link_url": "https://x.com/cohere/status/2035025921283883153",
    "primary_link_label": "来源链接 · x.com"
  }
}
