{
  "schema_version": "0.1.0",
  "source_ref": "/home/lyric/growth-engine-pipeline/content/runs/20260319_official_x_recheck_v3/03_source_items/official_x/items/x-xai-f2ae68a2fa14/source_item.json",
  "framework_match_ref": "/home/lyric/growth-engine-pipeline/content/runs/20260319_official_x_recheck_v3/06_routing/official_x/results/x-xai-f2ae68a2fa14/framework_match.json",
  "rewrite_context_ref": "/tmp/official_x_single/x-xai-f2ae68a2fa14/rewrite_context.json",
  "model": "codex-default",
  "generated_at": "2026-03-20T05:11:41Z",
  "output_language": "zh-CN",
  "framework_id": "02_launch_application",
  "submode_id": "feature_playbook",
  "requires_human_review": false,
  "title": "语音能力终于不只会“说话”：xAI 把 TTS API 推上线后，真正的分水岭其实是你敢不敢把它接进业务",
  "dek": "这次更新值得关注，不是因为“自然声音”四个字本身，而是因为 xAI 把语音链路、价格、速率限制和企业级合规条件一起摆上了桌面。问题也随之变得更现实：哪些场景现在可以直接开做，哪些还不该急着上。",
  "body_markdown": "“Text to Speech API 现已可用”这句话看起来像普通发布，但如果你做过语音产品，就知道真正麻烦的从来不是让模型开口，而是让它在真实业务里稳定、可控、接得进去。xAI 这次给出的不是一句模糊的能力宣告，而是一个已经带着价格、速率限制和基础设施说明的入口：Grok 的 Text to Speech Beta 已上线，提供 5 种声音，支持多种音频格式，并明确写了面向 telephony 和 web。\n\n这件事为什么重要？因为很多语音发布最后都会停在演示层：听起来不错，但没人知道怎么接进客服、外呼、网页助手，或者接进去之后成本和稳定性是不是马上失控。xAI 这次最有用的地方，不是“声音更自然”这种常规表述，而是它把整条语音能力栈放在同一个页面里讲清楚了。除了 TTS，还有通过 WebSocket 跑的 multilingual voice agents，带 native tool calling、MCP support 和 web search；再往下，还有 speech to text。你看到的不是一个孤立按钮，而是一条开始成形的语音工作流。\n\n先把概念说白。这里的 TTS，不只是把文本转成音频文件那么简单。按页面描述，它的定位是“从文本到语音”，但它被放进了一个更大的 Grok Voice 体系里。也就是说，如果你只是需要一段自然语音播报，它已经能干；如果你想继续往“会说、会想、会行动”的 voice agent 走，这个入口也没有把你锁死在单点能力上。\n\n这会直接影响采用判断。对很多团队来说，第一步不是上完整语音代理，而是先替换掉最呆板的一层输出，比如网页里的播报、电话里的固定回复、语音助手里那段最像机器人的收尾话术。现在 xAI 给出的 TTS Beta 定价是每 100 万字符 4.20 美元，速率限制是每分钟 600 次请求、每秒 10 次请求。别急着把它理解成“便宜”或者“贵”，更实际的结论是：它已经足够让你做面向产品的试点，而不是只能做一段宣传视频。\n\n真正值得先上手的场景，反而不是最复杂的那类。第一类是 telephony，因为页面明确写了“Built for telephony and web”，这等于直接告诉你它不是只为 demo 页准备的。第二类是 web 端的语音播报和交互反馈，尤其是那些本来就有稳定文本输出的地方。你先把现有文本链路接上 TTS，看音质、延迟、格式适配和请求上限能不能撑住，再决定要不要继续往实时语音代理升级，这条路径是顺的。\n\n如果你一上来就冲着“完整语音客服”去，判断反而容易失真。原因很简单：页面里最成熟、最完整的叙事其实是整套 Voice API，而不是单独一项 TTS。Voice Agent API 的定价写得也很清楚，实时语音对话通过 WebSocket，价格是每分钟 0.05 美元，也就是每小时 3.00 美元，团队上限 100 个 session。这个信息的意义，不是让你立刻全量采购，而是提醒你：xAI 想卖给你的不只是发声能力，而是实时语音交互本身。\n\n所以这次发布最适合谁？适合已经有文本产品、正在找一条低摩擦语音化路径的团队；也适合那些需要多语言入口、但不想一开始就搭重型语音栈的人。页面里把 multilingual、WebSocket、tool calling、MCP support、web search 放在一起，说明它瞄准的是“可接工具、可接搜索、可进业务流程”的方向，而不是一次性的语音玩具。\n\n但边界也要说透。第一，TTS 目前标的是 Beta，适合试点，不适合在信息极少的情况下直接默认成最终生产标准。第二，页面没有给出 5 种声音更细的风格差异，也没有展开不同语言下的具体表现，所以你不能把“多语言 voice agents”自动等同于“所有 TTS 声音在所有语言里都同样自然”。第三，speech to text 被写成在盲测中 top-ranked，并强调对口音和领域术语处理更强，但这些表述属于 STT，不该被偷换成 TTS 的结论。\n\n企业团队会在意的另一层，xAI 这次也提前摆出来了。SOC 2 Type II、HIPAA Eligible、GDPR Compliant、多区域基础设施、可定制 rate limits、SSO 与访问控制，这些词单独看很像标准配置，放在一起看才有意义：它在告诉你，这不是一个只能给开发者自己玩的小接口，而是准备去接企业流程和合规要求的产品。对采用者来说，这比华丽文案更重要，因为它决定了试点之后有没有机会往正式环境推进。\n\n如果你现在要做的不是“研究语音未来”，而是判断要不要开始，这里的第一步其实很简单：别先做完整 agent，先拿一个已经稳定输出文本的页面或电话节点，接入 TTS，验证 5 种声音、音频格式、请求速率和实际成本，再决定要不要往 WebSocket 的实时语音层继续扩。这样做的好处是，你测到的是业务里的摩擦，而不是宣传页里的想象。\n\n这也是这次发布真正的张力所在。xAI 已经把门开了，而且开得比很多“只会说自己很自然”的语音产品更具体；但门后面不是自动化的胜利，而是一连串采用判断。你当然可以把它理解成又一个 TTS API 上线，可更准确的说法是：语音这件事终于开始从“能不能做”转向“值不值得现在接进你的产品”。答案不是对所有人都一样，但至少这一次，xAI 给出的材料已经足够让你认真做一次判断，而不是只围观一段声音演示。",
  "preserved_fact_anchors": [
    "Grok's Text to Speech API is now available",
    "Text to Speech Beta",
    "Choose from five distinct voices and multiple audio formats",
    "Built for telephony and web",
    "Multilingual voice agents over WebSocket with native tool calling, MCP support, and web search",
    "$4.20 / 1M characters",
    "600 rpm requests per minute / 10 rps requests per second",
    "Voice Agent API Real-time voice conversations over WebSocket",
    "$0.05 / min($3.00 / hr)",
    "100 sessions / team"
  ],
  "style_observations": [
    "开头先用采用张力切入，再迅速落到 source 内的具体规格与价格。",
    "正文按“发布信号-白话定义-采用路径-适用场景-边界判断-立即动作”推进，但不显式模板化。",
    "语气保持技术现实主义，避免把发布写成官方说明书或纯新闻复述。"
  ],
  "open_questions": [
    "5 种声音各自的风格差异、支持语言范围与表现，source 未提供，文中未展开。",
    "TTS 在不同语言下的自然度、延迟和稳定性数据，source 未提供，文中仅保守描述。",
    "Speech to Text 的 benchmark 表现是否能迁移为整套 Voice API 的实际端到端体验，source 未提供，文中未做延伸判断。"
  ]
}
