{
  "schema_version": "0.1.0",
  "source_ref": "/home/lyric/growth-engine-pipeline/lane_v2/runs/20260324_t01_v2_realtime_exec1/01_source_items/official_x/items/x-openaidevs-e8a59b948d3c/source_item.json",
  "framework_match_ref": "/home/lyric/growth-engine-pipeline/lane_v2/runs/20260324_t01_v2_realtime_exec5/02_t01_topic_engine/06_writer_packets/topic-x-openaidevs-e8a59b948d3c/writer_packet.json#lane_assignment",
  "rewrite_context_ref": "/home/lyric/growth-engine-pipeline/lane_v2/runs/20260324_t01_v2_realtime_exec5/02_t01_topic_engine/06_writer_packets/topic-x-openaidevs-e8a59b948d3c/writer_packet.json#writer_packet",
  "model": "gpt-5.4",
  "generated_at": "2026-03-24T09:10:07Z",
  "output_language": "zh-CN",
  "framework_id": "02_launch_application",
  "submode_id": "release_showcase",
  "requires_human_review": true,
  "title": "给学生发 100 美元额度这件事，真正变的关键不在价格，而在Codex 开始抢占编程训练入口",
  "dek": "OpenAI Developers 在 2026 年 3 月 20 日推出面向美国和加拿大大学生的 Codex for Students，入口放在 chatgpt.com/codex/students。值得看的点不在补贴金额本身，而在于它把“构建、破坏、修复”的学习方式直接绑定到 Codex 的实际使用上；对目标学生这是低成本试错窗口，对其他人暂时还不是普遍利好。",
  "body_markdown": "很多发布看上去像营销动作，这次更像入口争夺。2026 年 3 月 20 日，@OpenAIDevs 在 X 上发布 Codex for Students，明确写出面向美国和加拿大的大学生提供 100 美元 Codex credits，并把入口直接放到 `chatgpt.com/codex/students`。金额不算夸张，但信号很清楚：OpenAI 开始把 Codex 从“会用的人主动找来用”推进到“学生在学习阶段就被带进来用”。\n\n更关键的是，这条发布没有把重点放在效率口号上，而是把目标写成“通过 build, break, fix 来学习”。这句话很重要，因为它把 Codex 的位置从一个演示型 AI 编程工具，往训练型工具挪了一步。学生拿到的关键不在一张优惠券那么简单，而在一段可以放心犯错、回滚、重试的实验预算。\n\n如果只看表面，这像一次校园福利；往下看，它其实在改学习路径。过去很多学生接触 AI 编程，多半停留在问答、生成片段代码、复制到本地再慢慢调。现在官方直接把额度和 Codex 绑定，等于在说：真正该练的与其盯着“问模型要答案”，不如看在一个 agent 式开发环境里持续试错。\n\n这个变化为什么值得单独写？因为训练入口一旦前移，习惯也会跟着前移。谁先在学生阶段形成工作流，谁就更容易在毕业后继续留在这套工具链里。100 美元当然有上限，但它足够把“我听说过 Codex”推进到“我真的用它做过几次项目修复和重构尝试”。\n\n这里有个前后对比。以前，学生要不要碰这类工具，常见阻力是三件事：怕花钱、怕不会配、怕试一次没结果。现在至少第一道门槛被官方拿掉了一部分，第二道门槛被入口页集中承接，第三道门槛则被“学习就是 build、break、fix”这套表述弱化了。它没有承诺你立刻写出更好的代码，但它确实在鼓励更像真实开发的练习方式。\n\n受影响最大的人群很具体。第一类是正在上编程课、做课程项目、参加 hackathon 的美国和加拿大大学生；他们最适合把这 100 美元用在小而完整的任务上，比如搭一个 demo、修一个旧项目、拆一次失败的实现再重做。第二类是自学型学生开发者，尤其是已经在用 CLI、编辑器插件或 agent 工作流的人，这笔额度能把“围观”变成“上手”。\n\n还有一类人会间接受益：教学生写代码的人。官方把学习目标定义成“构建、破坏、修复”，实际上给课程设计提供了一个更贴近真实工程的练习框架。以前很多练习只考最终答案，现在更容易把调试、失败恢复、迭代修改也纳入训练过程。对教学者来说，这比单纯发一份代码补全工具更有用。\n\n但边界也非常清楚。第一，资格范围只看到美国和加拿大的 college students，不能外推到全球学生，更不能当作面向所有开发者的降价动作。第二，公开信息里只有 100 美元 credits 和入口链接，没有看到更完整的配额规则、持续时间、可叠加条件或课程合作计划。第三，这条发布讲的是学习目标，不是性能承诺，所以别把它理解成“官方证明 Codex 已经覆盖全部开发工作”。\n\n这也是为什么非目标人群不该过度代入。企业团队、职业开发者、外包团队，如果现在看到“学生有额度”就把它解读成组织级 adoption 信号，判断会偏。它更像用户教育和习惯培养动作，不是面向所有角色的采购依据。你可以关注，但没必要因为这条消息立刻重写团队流程。\n\n从更大的生态看，这个动作也不是孤立的。3 月 21 日，开发者 @svpino 在另一条 X 帖子里提到，一个开源 AWP 项目已经把 Codex 列为可兼容的 agent 之一，与 Claude Code、Cursor、Gemini CLI 并列。这至少说明一件事：Codex 正被放进更真实的 agent 工具讨论里，而学生补贴会进一步增加它被拿来尝试这类工作流的概率。\n\n真正值得注意的地方，在于 OpenAI 这次没有先讲宏大愿景，而是先给一个很实际的入口。`chatgpt.com/codex/students` 这种直达页设计，本身就在降低决策成本。学生不需要先理解完整产品路线图，只需要判断自己是否符合资格、有没有一个想做的小项目，然后开始用。对于早期采用，降低决策成本往往比多讲几个 feature 更有效。\n\n当然，免费额度也会带来典型误区。最常见的是把它花在过大的任务上，结果几次尝试后没有形成任何可复用经验；或者把它当成“替你写完整项目”的预算，最后只得到一堆自己没法维护的输出。既然官方把学习方式写成 build、break、fix，更合理的用法就是把额度拆给多个短周期任务，让失败也有产出。\n\n如果你是符合条件的学生，最好的起手式挑一个边界清楚的小任务：给课程项目补一个功能、把旧仓库修到能跑、把一段混乱脚本重构清楚才是核心，追求一次做成更像表层现象。这样最能验证 Codex 对你有没有真实帮助，也最符合这次发布表达出来的学习方向。\n\n如果你是老师、学生社群组织者或 hackathon 发起方，这条消息值得收藏和转发。它给了一个低门槛入口，也给了一个更像工程训练的叙事框架。你完全可以围绕“构建、破坏、修复”去设计一次练习，而不是把 AI 工具只当成作业加速器。\n\n如果你不在美国和加拿大高校体系内，当前更合适的动作是观察，而不是跟着兴奋。先看后续有没有资格扩展、额度规则补充、课程合作案例，或者更多独立开发者把 Codex 放进真实工作流验证。眼下的信息足够支持“这是一条重要的学生入口信号”，还不足以支持“所有人都该马上转向”。\n\n我的判断很直接：符合资格的学生可以立刻试用，但要把它当训练预算来用；教学者和开发者社区可以先观察并设计轻量实验；企业团队和非目标地区用户暂缓，不要把这次发布误读成全面降价或通用 adoption 结论。100 美元本身有限，真正更大的变化是，Codex 开始在学习阶段争夺未来开发者的默认习惯。",
  "preserved_fact_anchors": [
    "2026 年 3 月 20 日 @OpenAIDevs 发布 Codex for Students",
    "面向美国和加拿大的大学生",
    "提供 100 美元 Codex credits",
    "目标是支持学生通过 build、break、fix 来学习",
    "入口为 chatgpt.com/codex/students",
    "@svpino 在 2026 年 3 月 21 日提到 Codex 被列为兼容 agent 之一"
  ],
  "style_observations": [
    "标题给出判断和 stakes，没有改写公告标题。",
    "Dek 直接回答真正变化：学生补贴背后是训练入口前移。",
    "开头两段同时出现发布动作、来源身份和高价值判断。",
    "中段写了前后对比、受影响人群、非适用边界和风险。",
    "结尾给出立刻试用、观察、暂缓三档行动建议。",
    "全文以事实锚点为骨架，没有把正文写成公告复述或帮助中心。"
  ],
  "open_questions": [
    "100 美元 credits 的具体使用期限、发放方式和资格验证规则，当前材料未披露。",
    "是否只覆盖部分学校或学籍类型，当前材料未披露。",
    "Codex for Students 是否会扩展到美国和加拿大以外地区，当前材料未披露。"
  ],
  "article_blocks": [
    {
      "type": "hero_heading",
      "text": "OpenAI Developers 在 2026 年 3 月 20 日推出面向美国和加拿大大学生的 Codex for Students，入口放在 chatgpt.com/codex/students。值得看的点不在补贴金额本身，而在于它把“构建、破坏、修复”的学习方式直接绑定到 Codex 的实际使用上；对目标学生这是低成本试错窗口，对其他人暂时还不是普遍利好。"
    },
    {
      "type": "paragraph",
      "text": "很多发布看上去像营销动作，这次更像入口争夺。2026 年 3 月 20 日，@OpenAIDevs 在 X 上发布 Codex for Students，明确写出面向美国和加拿大的大学生提供 100 美元 Codex credits，并把入口直接放到 `chatgpt.com/codex/students`。金额不算夸张，但信号很清楚：OpenAI 开始把 Codex 从“会用的人主动找来用”推进到“学生在学习阶段就被带进来用”。"
    },
    {
      "type": "paragraph",
      "text": "更关键的是，这条发布没有把重点放在效率口号上，而是把目标写成“通过 build, break, fix 来学习”。这句话很重要，因为它把 Codex 的位置从一个演示型 AI 编程工具，往训练型工具挪了一步。学生拿到的关键不在一张优惠券那么简单，而在一段可以放心犯错、回滚、重试的实验预算。"
    },
    {
      "type": "paragraph",
      "text": "如果只看表面，这像一次校园福利；往下看，它其实在改学习路径。过去很多学生接触 AI 编程，多半停留在问答、生成片段代码、复制到本地再慢慢调。现在官方直接把额度和 Codex 绑定，等于在说：真正该练的与其盯着“问模型要答案”，不如看在一个 agent 式开发环境里持续试错。"
    },
    {
      "type": "paragraph",
      "text": "这个变化为什么值得单独写？因为训练入口一旦前移，习惯也会跟着前移。谁先在学生阶段形成工作流，谁就更容易在毕业后继续留在这套工具链里。100 美元当然有上限，但它足够把“我听说过 Codex”推进到“我真的用它做过几次项目修复和重构尝试”。"
    },
    {
      "type": "paragraph",
      "text": "这里有个前后对比。以前，学生要不要碰这类工具，常见阻力是三件事：怕花钱、怕不会配、怕试一次没结果。现在至少第一道门槛被官方拿掉了一部分，第二道门槛被入口页集中承接，第三道门槛则被“学习就是 build、break、fix”这套表述弱化了。它没有承诺你立刻写出更好的代码，但它确实在鼓励更像真实开发的练习方式。"
    },
    {
      "type": "paragraph",
      "text": "受影响最大的人群很具体。第一类是正在上编程课、做课程项目、参加 hackathon 的美国和加拿大大学生；他们最适合把这 100 美元用在小而完整的任务上，比如搭一个 demo、修一个旧项目、拆一次失败的实现再重做。第二类是自学型学生开发者，尤其是已经在用 CLI、编辑器插件或 agent 工作流的人，这笔额度能把“围观”变成“上手”。"
    },
    {
      "type": "paragraph",
      "text": "还有一类人会间接受益：教学生写代码的人。官方把学习目标定义成“构建、破坏、修复”，实际上给课程设计提供了一个更贴近真实工程的练习框架。以前很多练习只考最终答案，现在更容易把调试、失败恢复、迭代修改也纳入训练过程。对教学者来说，这比单纯发一份代码补全工具更有用。"
    },
    {
      "type": "paragraph",
      "text": "但边界也非常清楚。第一，资格范围只看到美国和加拿大的 college students，不能外推到全球学生，更不能当作面向所有开发者的降价动作。第二，公开信息里只有 100 美元 credits 和入口链接，没有看到更完整的配额规则、持续时间、可叠加条件或课程合作计划。第三，这条发布讲的是学习目标，不是性能承诺，所以别把它理解成“官方证明 Codex 已经覆盖全部开发工作”。"
    },
    {
      "type": "paragraph",
      "text": "这也是为什么非目标人群不该过度代入。企业团队、职业开发者、外包团队，如果现在看到“学生有额度”就把它解读成组织级 adoption 信号，判断会偏。它更像用户教育和习惯培养动作，不是面向所有角色的采购依据。你可以关注，但没必要因为这条消息立刻重写团队流程。"
    },
    {
      "type": "paragraph",
      "text": "从更大的生态看，这个动作也不是孤立的。3 月 21 日，开发者 @svpino 在另一条 X 帖子里提到，一个开源 AWP 项目已经把 Codex 列为可兼容的 agent 之一，与 Claude Code、Cursor、Gemini CLI 并列。这至少说明一件事：Codex 正被放进更真实的 agent 工具讨论里，而学生补贴会进一步增加它被拿来尝试这类工作流的概率。"
    },
    {
      "type": "paragraph",
      "text": "真正值得注意的地方，在于 OpenAI 这次没有先讲宏大愿景，而是先给一个很实际的入口。`chatgpt.com/codex/students` 这种直达页设计，本身就在降低决策成本。学生不需要先理解完整产品路线图，只需要判断自己是否符合资格、有没有一个想做的小项目，然后开始用。对于早期采用，降低决策成本往往比多讲几个 feature 更有效。"
    },
    {
      "type": "paragraph",
      "text": "当然，免费额度也会带来典型误区。最常见的是把它花在过大的任务上，结果几次尝试后没有形成任何可复用经验；或者把它当成“替你写完整项目”的预算，最后只得到一堆自己没法维护的输出。既然官方把学习方式写成 build、break、fix，更合理的用法就是把额度拆给多个短周期任务，让失败也有产出。"
    },
    {
      "type": "paragraph",
      "text": "如果你是符合条件的学生，最好的起手式挑一个边界清楚的小任务：给课程项目补一个功能、把旧仓库修到能跑、把一段混乱脚本重构清楚才是核心，追求一次做成更像表层现象。这样最能验证 Codex 对你有没有真实帮助，也最符合这次发布表达出来的学习方向。"
    },
    {
      "type": "paragraph",
      "text": "如果你是老师、学生社群组织者或 hackathon 发起方，这条消息值得收藏和转发。它给了一个低门槛入口，也给了一个更像工程训练的叙事框架。你完全可以围绕“构建、破坏、修复”去设计一次练习，而不是把 AI 工具只当成作业加速器。"
    },
    {
      "type": "paragraph",
      "text": "如果你不在美国和加拿大高校体系内，当前更合适的动作是观察，而不是跟着兴奋。先看后续有没有资格扩展、额度规则补充、课程合作案例，或者更多独立开发者把 Codex 放进真实工作流验证。眼下的信息足够支持“这是一条重要的学生入口信号”，还不足以支持“所有人都该马上转向”。"
    },
    {
      "type": "paragraph",
      "text": "我的判断很直接：符合资格的学生可以立刻试用，但要把它当训练预算来用；教学者和开发者社区可以先观察并设计轻量实验；企业团队和非目标地区用户暂缓，不要把这次发布误读成全面降价或通用 adoption 结论。100 美元本身有限，真正更大的变化是，Codex 开始在学习阶段争夺未来开发者的默认习惯。"
    },
    {
      "type": "link_cta",
      "text": "如果你想看原始论证链，可以直接读原文：",
      "url": "https://x.com/OpenAIDevs/status/2035033703274201109",
      "label": "来源链接 · x.com"
    }
  ],
  "publishing_hints": {
    "source_label": "OpenAI Developers",
    "source_url": "https://x.com/OpenAIDevs/status/2035033703274201109",
    "primary_link_url": "https://x.com/OpenAIDevs/status/2035033703274201109",
    "primary_link_label": "来源链接 · x.com"
  }
}
