{
  "schema_version": "0.1.0",
  "source_ref": "/home/lyric/growth-engine-pipeline/lane_v2/runs/20260325_t01_v2_rerun_v1/01_source_items/article_x/items/x-op7418-b9e09e039182/source_item.json",
  "framework_match_ref": "/home/lyric/growth-engine-pipeline/lane_v2/runs/20260325_t01_wechat_single/02_t01_topic_engine/06_writer_packets/topic-x-op7418-b9e09e039182/writer_packet.json#lane_assignment",
  "rewrite_context_ref": "/home/lyric/growth-engine-pipeline/lane_v2/runs/20260325_t01_wechat_single/02_t01_topic_engine/06_writer_packets/topic-x-op7418-b9e09e039182/writer_packet.json#writer_packet",
  "model": "gpt-5.4",
  "generated_at": "2026-03-25T08:01:56Z",
  "output_language": "zh-CN",
  "framework_id": "02_launch_application",
  "submode_id": "release_showcase",
  "requires_human_review": true,
  "title": "微信接入不算小修小补，Claude-to-IM-Skills 把远程编程助手从“能连”推到了“愿意试”",
  "dek": "这次更新给 Claude Code 和 CodeX 多了一个消息入口，更关键的是把配置动作压到了“自动开网页、扫码即可”。当远程连接从折腾配置变成扫码绑定，试用门槛会明显下降，但它依然更适合轻量协作和即时触发，不适合承接高风险代码操作。",
  "body_markdown": "把 AI 编程助手接到 IM 里，过去听起来像极客玩具；这次更新后，它开始有一点工作流入口的味道了。2026 年 3 月 24 日，@op7418 提到，原本“Claude Code 和 CodeX 远程连接到飞书 IM 的插件 Claude-to-IM-Skills 更新了”，现在“将你的 Claude Code 和 CodeX 远程连接到微信”，而且配置方式变成“它会自动打开一个网页，你扫码就行”。\n\n关键不只是“支持微信”这四个字。更实际的变化有两点：远程接入这类能力碰到了国内开发者最熟悉的通知和协作入口，同时把配置门槛压得很低。以前这类工具就算功能成立，也常常卡在接入复杂、团队里只有一两个人愿意折腾；现在它至少把“我先连上试试”这一步做顺了。\n\n先把这次更新翻成白话。Claude-to-IM-Skills 原来瞄准的是“飞书 IM 里的远程连接”，这次往前走了一步，把微信也纳入进来。对象很明确：Claude Code、CodeX、IM、Skills 这几个原本分散的东西，被塞进了一个更接近日常消息流的入口里。你不需要先接受一套新工作台，先扫码，把通道打通，再决定要不要继续深用。\n\n它更可能先改变调用频率，模型能力上限并没有因为入口变化而抬高。很多人手里已经有 Claude Code 或 CodeX 这类能力，但真正掉进日常工作的动作很少，因为打开终端、切换环境、处理权限确认，本身就比“发一条消息”重。入口一轻，使用习惯就会变。远程让它更像一个随手叫来的执行助手，从一段专门腾出时间才会启动的流程里走了出来。\n\n换个角度看，这次更新是在补 adoption，关于 imagination 的想象空间其实并不缺。大家早就知道 AI 编程助手可以读上下文、改代码、跑任务，可一旦离开电脑主界面，链路就断了。现在把微信接进来，价值不在炫技，价值在于你终于可以把“提醒它看一眼”“让它回报状态”“先丢一个轻任务进去”这类碎片动作放到原本就高频的沟通场景里。\n\n这也是“飞书 IM 插件更新”比字面上更重要的原因。它告诉你，插件没有停在某个单一办公生态里，而是在往更通用、更低摩擦的消息入口扩。对个人开发者、独立黑客、需要远程盯进度的小团队负责人来说，这比再多一个抽象功能名更有用，因为它直接决定你会不会真的打开它第二次。\n\n不过别把这件事想大了。微信接入不等于你以后可以脱离本地环境完成所有开发流程，也不等于它会自动替代 IDE、代码审查、CI/CD 这些原有环节。消息型入口天然适合短指令、状态同步、轻触发，遇到长链路调试、复杂 diff 审核、敏感配置修改，主战场仍然在原来的工程环境里。\n\n边界还不止这一层。只要涉及源码、命令执行和远程连接，风险就会跟着入口一起移动。支持微信，意味着可达性更强，也意味着误触、误发、多人混线、权限感知变弱这些问题更现实。现有材料只说明它“自动打开一个网页，你扫码就行”，没有给出更细的权限、隔离、审计信息，所以任何涉及生产库、密钥、公司私有仓库的场景，都不该因为接入变简单就直接放开使用。\n\n为什么这个判断现在成立？因为周边信号已经说明，这类 coding agent 正在从演示走向工作流。OpenAI 开发者账号在 2026 年 3 月 24 日提到，Codex 已被用于把一个现有移动端能力扩到 web 和 desktop；另一个相关信号是，Claude Code 同期推出了 auto mode，试图在“全手动批准”和“完全跳过权限”之间找中间路线。它们和这个插件更新不是一回事，但指向同一个现实：大家都在补一件事，怎么让 agent 更自然地嵌进真实工作，而不是停在命令行表演。\n\n落到具体人群，谁会最先受益？第一类是一个人盯多个项目的人，人在路上、会里、或者不在工位，也想低成本追状态、丢任务、收结果。第二类是已经把微信当作工作通知中心的人，他们不缺模型，缺的是少切一次环境。第三类是想低门槛试试“远程编程助手”到底有没有用的人，这次扫码式配置，刚好把试错成本压下来了。\n\n谁反而不该急着上？一是对合规、审计、权限边界要求很重的团队。二是日常任务高度依赖复杂代码评审、长上下文交互的人。三是还没建立最基本 agent 使用规范的团队：谁能发指令、谁能看结果、什么任务允许远程触发、什么任务必须回到本机，这些规则没定好，入口越顺，后面越容易乱。\n\n所以这次更新，我的判断是偏积极，但只给到“该试”，不给到“该全面迁移”。它解决的是 adoption 的第一公里，特别是把 Claude Code、CodeX 接到微信这一点，确实把试用门槛降下来了；它还没有证明自己能稳定承接更深的工程职责。把它当成远程触发层、状态同步层、轻任务入口，判断会更稳。\n\n如果你是个人开发者或者两三人的小团队，现在就可以立刻试一次，重点看三件事：扫码接入是否顺、消息往返是否稳定、你最常见的轻任务能不能在微信里闭环。如果你在中型以上团队，先观察权限设计和审计能力，再决定是否扩到真实项目。如果你的环境涉及敏感代码和高风险命令，现阶段更适合暂缓，把它放在隔离项目里做边界测试。最后留一个值得讨论的问题：当 AI 编程助手真正进入微信这类高频入口后，你最想要的是“随时能叫到”，还是“默认别乱动”？",
  "preserved_fact_anchors": [
    "Claude Code 和 CodeX 远程连接到飞书 IM 的插件 Claude-to-IM-Skills 更新了",
    "将你的 Claude Code 和 CodeX 远程连接到微信",
    "而且配置方式极其简单：它会自动打开一个网页，你扫码就行",
    "Claude Code",
    "CodeX",
    "IM",
    "Skills"
  ],
  "style_observations": [
    "开头两段直接给出发布动作和判断，没有停留在公告复述。",
    "中段完成了前后变化、适用人群、风险边界三层展开，并把讨论从接入动作推进到工作流影响。",
    "语言保持口语和判断感，避开模板化分点和宣传腔。",
    "结尾给出立刻试用、观察、暂缓三种动作，并附带一个可讨论问题。"
  ],
  "open_questions": [
    "插件当前是否提供更细的权限控制、操作审计或隔离说明？",
    "微信接入后，支持的任务范围是状态通知、问答触发，还是包含实际代码与命令执行？",
    "Claude Code 与 CodeX 在这个插件里的能力边界是否一致？"
  ],
  "article_blocks": [
    {
      "type": "hero_heading",
      "text": "这次更新给 Claude Code 和 CodeX 多了一个消息入口，更关键的是把配置动作压到了“自动开网页、扫码即可”。当远程连接从折腾配置变成扫码绑定，试用门槛会明显下降，但它依然更适合轻量协作和即时触发，不适合承接高风险代码操作。"
    },
    {
      "type": "paragraph",
      "text": "把 AI 编程助手接到 IM 里，过去听起来像极客玩具；这次更新后，它开始有一点工作流入口的味道了。2026 年 3 月 24 日，@op7418 提到，原本“Claude Code 和 CodeX 远程连接到飞书 IM 的插件 Claude-to-IM-Skills 更新了”，现在“将你的 Claude Code 和 CodeX 远程连接到微信”，而且配置方式变成“它会自动打开一个网页，你扫码就行”。"
    },
    {
      "type": "paragraph",
      "text": "关键不只是“支持微信”这四个字。更实际的变化有两点：远程接入这类能力碰到了国内开发者最熟悉的通知和协作入口，同时把配置门槛压得很低。以前这类工具就算功能成立，也常常卡在接入复杂、团队里只有一两个人愿意折腾；现在它至少把“我先连上试试”这一步做顺了。"
    },
    {
      "type": "paragraph",
      "text": "先把这次更新翻成白话。Claude-to-IM-Skills 原来瞄准的是“飞书 IM 里的远程连接”，这次往前走了一步，把微信也纳入进来。对象很明确：Claude Code、CodeX、IM、Skills 这几个原本分散的东西，被塞进了一个更接近日常消息流的入口里。你不需要先接受一套新工作台，先扫码，把通道打通，再决定要不要继续深用。"
    },
    {
      "type": "paragraph",
      "text": "它更可能先改变调用频率，模型能力上限并没有因为入口变化而抬高。很多人手里已经有 Claude Code 或 CodeX 这类能力，但真正掉进日常工作的动作很少，因为打开终端、切换环境、处理权限确认，本身就比“发一条消息”重。入口一轻，使用习惯就会变。远程让它更像一个随手叫来的执行助手，从一段专门腾出时间才会启动的流程里走了出来。"
    },
    {
      "type": "paragraph",
      "text": "换个角度看，这次更新是在补 adoption，关于 imagination 的想象空间其实并不缺。大家早就知道 AI 编程助手可以读上下文、改代码、跑任务，可一旦离开电脑主界面，链路就断了。现在把微信接进来，价值不在炫技，价值在于你终于可以把“提醒它看一眼”“让它回报状态”“先丢一个轻任务进去”这类碎片动作放到原本就高频的沟通场景里。"
    },
    {
      "type": "paragraph",
      "text": "这也是“飞书 IM 插件更新”比字面上更重要的原因。它告诉你，插件没有停在某个单一办公生态里，而是在往更通用、更低摩擦的消息入口扩。对个人开发者、独立黑客、需要远程盯进度的小团队负责人来说，这比再多一个抽象功能名更有用，因为它直接决定你会不会真的打开它第二次。"
    },
    {
      "type": "paragraph",
      "text": "不过别把这件事想大了。微信接入不等于你以后可以脱离本地环境完成所有开发流程，也不等于它会自动替代 IDE、代码审查、CI/CD 这些原有环节。消息型入口天然适合短指令、状态同步、轻触发，遇到长链路调试、复杂 diff 审核、敏感配置修改，主战场仍然在原来的工程环境里。"
    },
    {
      "type": "paragraph",
      "text": "边界还不止这一层。只要涉及源码、命令执行和远程连接，风险就会跟着入口一起移动。支持微信，意味着可达性更强，也意味着误触、误发、多人混线、权限感知变弱这些问题更现实。现有材料只说明它“自动打开一个网页，你扫码就行”，没有给出更细的权限、隔离、审计信息，所以任何涉及生产库、密钥、公司私有仓库的场景，都不该因为接入变简单就直接放开使用。"
    },
    {
      "type": "paragraph",
      "text": "为什么这个判断现在成立？因为周边信号已经说明，这类 coding agent 正在从演示走向工作流。OpenAI 开发者账号在 2026 年 3 月 24 日提到，Codex 已被用于把一个现有移动端能力扩到 web 和 desktop；另一个相关信号是，Claude Code 同期推出了 auto mode，试图在“全手动批准”和“完全跳过权限”之间找中间路线。它们和这个插件更新不是一回事，但指向同一个现实：大家都在补一件事，怎么让 agent 更自然地嵌进真实工作，而不是停在命令行表演。"
    },
    {
      "type": "paragraph",
      "text": "落到具体人群，谁会最先受益？第一类是一个人盯多个项目的人，人在路上、会里、或者不在工位，也想低成本追状态、丢任务、收结果。第二类是已经把微信当作工作通知中心的人，他们不缺模型，缺的是少切一次环境。第三类是想低门槛试试“远程编程助手”到底有没有用的人，这次扫码式配置，刚好把试错成本压下来了。"
    },
    {
      "type": "paragraph",
      "text": "谁反而不该急着上？一是对合规、审计、权限边界要求很重的团队。二是日常任务高度依赖复杂代码评审、长上下文交互的人。三是还没建立最基本 agent 使用规范的团队：谁能发指令、谁能看结果、什么任务允许远程触发、什么任务必须回到本机，这些规则没定好，入口越顺，后面越容易乱。"
    },
    {
      "type": "paragraph",
      "text": "所以这次更新，我的判断是偏积极，但只给到“该试”，不给到“该全面迁移”。它解决的是 adoption 的第一公里，特别是把 Claude Code、CodeX 接到微信这一点，确实把试用门槛降下来了；它还没有证明自己能稳定承接更深的工程职责。把它当成远程触发层、状态同步层、轻任务入口，判断会更稳。"
    },
    {
      "type": "paragraph",
      "text": "如果你是个人开发者或者两三人的小团队，现在就可以立刻试一次，重点看三件事：扫码接入是否顺、消息往返是否稳定、你最常见的轻任务能不能在微信里闭环。如果你在中型以上团队，先观察权限设计和审计能力，再决定是否扩到真实项目。如果你的环境涉及敏感代码和高风险命令，现阶段更适合暂缓，把它放在隔离项目里做边界测试。最后留一个值得讨论的问题：当 AI 编程助手真正进入微信这类高频入口后，你最想要的是“随时能叫到”，还是“默认别乱动”？"
    },
    {
      "type": "link_cta",
      "text": "如果你想看原始论证链，可以直接读原文：",
      "url": "https://x.com/op7418/status/2036260385490346133",
      "label": "来源链接 · x.com"
    }
  ],
  "publishing_hints": {
    "source_label": "op7418",
    "source_url": "https://x.com/op7418/status/2036260385490346133",
    "primary_link_url": "https://x.com/op7418/status/2036260385490346133",
    "primary_link_label": "来源链接 · x.com"
  }
}
